Phase,Start Date,End Date,Duration (Weeks),Goal,Key Deliverables,Exit Criteria,Priority,Notes
"Phase 0 - Scope & Design","2026-04-01","2026-04-07","1","Chot pham vi MVP va contract ky thuat","DB schema v1; MQTT contract v1; API surface v1; role matrix v1; MVP scope v1","Backend, MCU va UI thong nhat payload, topic, schema va scope MVP","Critical","Completed 2026-03-31: full phase0 docs locked for execution"
"Phase 1 - Infra & Project Setup","2026-04-08","2026-04-21","2","Dung nen Ubuntu, PostgreSQL, MQTT, Next.js","Workspace setup; local compose; db migration/reset scripts; api health/ready; worker ingest baseline; env template; smoke test","He thong dev/staging chay duoc, migrate DB thanh cong, API healthcheck OK","Critical","Completed baseline 2026-03-31: ready to push Git and deploy Ubuntu"
"Phase 2 - MCU Ingest","2026-04-22","2026-05-12","3","Nhan du lieu heartbeat, telemetry, event tu MCU","Worker subscribe MQTT; validator; ingest pipeline; raw log/audit","MCU test gui du lieu vao DB on dinh, worker reconnect duoc","Critical","Phase de phat sinh sua contract nhieu nhat"
"Phase 3 - Package & Usage","2026-05-13","2026-06-09","4","Lam nghiep vu tao gia tri som","Package CRUD; quota logic; user usage; usage aggregation; alert co ban","Tinh va hien thi duoc usage theo user, quota hoat dong dung","Critical","Tap trung dung du lieu truoc khi polish UI"
"Phase 4 - Captain Portal & VMS","2026-06-10","2026-06-30","3","Mo giao dien toi thieu cho captain va theo doi VMS","Captain dashboard; user online; quota view; VMS basic tracking","Captain xem duoc du lieu tau minh, VMS hien thi duoc vi tri/trang thai","High","Chi lam dashboard can thiet cho pilot"
"Phase 5 - Command Flow & RBAC","2026-07-01","2026-07-21","3","Hoan thien luong dieu khien 2 chieu va phan quyen","Command job; ACK/result; RBAC; audit log","Server gui lenh xuong MCU va nhan phan hoi, phan quyen dung","High","Neu tre deadline co the cat bot lenh nang cao"
"Phase 6 - Staging & Pilot","2026-07-22","2026-08-11","3","Kiem thu, staging, pilot va tai lieu van hanh","Test checklist; staging deploy; pilot rollout; runbook; rollback plan","Pilot on dinh, co the demo/go-live than trong","Critical","Khong go-live rong neu chua qua pilot"
